name,location,occupation,testimonial
Natália da Silva Fortunato,Armação dos Búzios/RJ,QUILOMBOLA DOS REMANESCENTES DE BAÍA FORMOSA,"Antes, eu me sentia acuada por não entender alguns dos conflitos que enfrentamos dentro e fora da comunidade. Hoje, compreendo melhor e até consigo opinar sobre eles. O Rede me trouxe esclarecimento e entendimento sobre muitas coisas.Hoje, temos um CEP e uma rua oficializada, por meio da qual podemos receber nossas encomendas, além de termos água e luz legalizadas. Antes, eu era muito tímida e não sabia me expressar. Hoje, por meio do Teatro do Oprimido, consigo falar e lidar com alguns assuntos sem medo"
Clemilda Barreiros,Itapemirim/ES,Marisqueira,"O projeto significa uma formação que nos possibilita integração e participação para que possamos correr atrás dos nossos direitos e do reconhecimento da nossa classe. Ele contribui como uma forte aliança que nos ajuda a perder o medo e a lutar pelos nossos direitos e objetivos. Eu me sentia envergonhada quando ia a lugares como hospitais e lojas, e me perguntavam qual era a minha profissão. Eu dizia que era marisqueira. Hoje, me sinto orgulhosa. Nossas conquistas incluem o reconhecimento: por exemplo, a prefeitura já nos apoia, e a Defensoria Pública do Estado já nos ouve. Claro que ainda há muito a ser conquistado, mas já estamos no caminho de um futuro melhor. O PEA Rede Observação fez e continua fazendo muita diferença em nossas vidas, nos fortalecendo, abraçando nossas causas, vivenciando nossos conflitos e sempre nos auxiliando nos caminhos que nosso grupo está trilhando"
Edna Mendonça,Macaé/RJ,Agricultora Familiar no PDS Osvaldo de Oliveira,"O Rede Observação significa a boa semente para o agricultor, 'aquela semente que faz a diferença na nossa vida'. O projeto nos auxiliou e nos preparou para termos voz, para nos organizarmos de maneira coletiva e nos deu forças para, juntos, buscarmos nossos direitos. Eu era apenas uma agricultora que produzia e lutava por melhores condições de vida. Hoje, com o projeto, me sinto mais forte para, junto dos meus companheiros e companheiras, lutarmos por melhorias. Me sinto amparada e apoiada, assim como minha comunidade. Os aprendizados e o senso de coletividade foram essenciais para enfrentarmos o processo de desapropriação do assentamento. Também têm feito a diferença na Travessia, que possibilitou identificar problemas coletivos, escutar as pessoas e aproximar aquelas que viviam em núcleos mais distantes. Quando o Rede chegou, eu estava triste por causa da ordem de despejo. Mas, com a chegada do projeto, houve um esforço para compreender o processo e atuar coletivamente. Eles participaram da audiência pública organizada pela Marina, do MST, e nos ajudaram a levar materiais de comunicação, como um boletim e um banner sobre o território, com imagens do antes e depois da nossa chegada, entre outras ações. Com essa ajuda, conseguimos derrubar a liminar. E, a partir disso, me senti fortalecida. Tenho aprendido muito a não ser mais oprimida e a lutar cada vez mais pelos meus direitos, junto da minha comunidade"
Livia Marcia Rodrigues dos Reis,Campos/RJ,QUILOMBO DE LAGOA FEA,"O projeto nos impulsiona a ir mais longe, facilita a busca por direitos e ampliou a minha compreensão. Antes, eu não sabia o que era ser quilombola. Depois que o Rede chegou ao nosso território, ficou mais claro o que significa o nosso reconhecimento. Hoje em dia, a gente se reconhece como quilombola. A criação do estatuto da associação e, principalmente, o reconhecimento como comunidade quilombola. Se não fosse o Rede Observação, eu não saberia dos nossos direitos e nem que somos quilombolas. Além disso, o eixo de Teatro do Oprimido me ajudou a perder a vergonha, porque antes eu era muito tímida"
Lucélia Cândido de Jesus,São João da Barra/RJ,,"O PEA Rede Observação é um espaço onde eu posso debater as dificuldades da comunidade Pesqueira com aprendizado e conhecimento sobre o nosso papel na sociedade. Contribui com estudos que nos fortalecem, e nos mobiliza para cobrar nossos direitos de maneira organizada e ciente. Antes do Rede Observação, eu era apenas uma pessoa que vivia e aceitava os problemas da pesca como uma coisa normal, depois eu aprendi que além dos deveres com a nossa comunidade temos muitos direitos também. Além das conquistas que podemos ver, como as inscrições para o subsídio do óleo diesel para os pescadores, estamos vendo falar mais sobre a classe pesqueira e com mais abertura dos meios para manifestar nossas reclamações e sendo mais ouvidos. Hoje, consigo falar mais em público, passar o que eu penso, e querer conquistar os nossos direitos para todo o nosso redor. Um exemplo, foi manifestar minha indignação em uma audiência, o que eu nunca havia feito"
Iracema Mariano,Rio das Ostras/Cantagalo RJ,Agricultora Familiar do Coletivo Andorinhas,"Hoje, sou reconhecida como agricultora familiar de Cantagalo e tenho o privilégio de representar o Coletivo Andorinhas em diversas feiras, incluindo na Universidade Federal Fluminense (UFF) e em empresas multinacionais, como a OneSubsea. Fazer parte desse coletivo é um grande orgulho para mim, pois tenho a oportunidade de mostrar o trabalho das agricultoras familiares de Cantagalo e de Rio das Ostras, contribuindo para a valorização e o reconhecimento da nossa contribuição para a sociedade.Minha participação no PEA Rede Observação foi um divisor de águas em minha vida. Esse apoio tem sido fundamental não apenas para mim, mas para todos os membros do Coletivo Andorinhas. É um testemunho do impacto positivo que o projeto  pode ter na vida das pessoas"
Ihago Alves Clemente,Araruama/RJ,Articulador local,"Vejo de perto a diferença que a educação ambiental faz na vida das pessoas, não só do sujeito prioritário, mas de todos que fazem parte da ação educativa. O trabalho de organização e o empoderamento que acontece em uma comunidade são emocionantes e inspiradores de presenciar, e me sinto honrado em participar disso. O PEA começa a transformar a vida do grupo, em seu primeiro contato. Quando o sujeito percebe que existe uma política pública voltada para manter e garantir suas atividades culturais, isso ajuda a despertar o sentimento de luta e resistência que cada pessoa carrega. Além disso, o cuidado, a disponibilidade de informações e o apoio que trocamos são fundamentais para que o grupo se organize e se fortaleça, os ajudando a sair da zona de conforto e lutar por seus direitos"
Armando dos Santos e Lemos,São Francisco de Itabapoana/RJ,Agricultor familiar,"Desenvolvi meu lado emocional e me sinto bem em estar com as pessoas do projeto, temos lutado por nossas demandas e aos poucos vamos alcançando. Com fé vamos adquirir muito conhecimento para ficar mais informados e nunca desistir. O grupo tem crescido em número e conhecimento e todos que entraram tem juntado força. Hoje o projeto tem me fortalecido. As conquistas são as somatórias de todas as pessoas ocupando espaços públicos"
